{
  "schemaVersion": 1,
  "planId": "ubiubi18-governance-build-v1",
  "status": "experimental-local-only",
  "forkReleaseId": "idena-code-governance-day-fork-candidate-2026.07.17-v6",
  "sourceDateEpoch": 1783963545,
  "toolchains": {
    "go": "1.26.5",
    "rust": "1.97.0",
    "node": "24.18.0",
    "npm": "11.16.0",
    "pnpm": "11.11.0",
    "assemblyscript": "0.27.37"
  },
  "targets": [
    {
      "id": "rust-workspace",
      "sourceRepositories": ["P2poolBTC"],
      "requiredToolchains": ["rust"],
      "dependencyLocks": [
        {
          "repository": "P2poolBTC",
          "path": "Cargo.lock",
          "sha256": "f088982ab96fa8aeeb60fb764a8a7b98130840b0768f7a2fc9bc5c7610e5a6c4",
          "format": "cargo-lock"
        }
      ],
      "commands": [
        "cargo fetch --locked",
        "cargo fmt --all -- --check",
        "cargo clippy --offline --workspace --all-targets --all-features -- -D warnings",
        "cargo test --offline --workspace",
        "cargo build --offline --workspace --release --locked"
      ],
      "dependencyFetchCommandCount": 1,
      "artifacts": [
        {
          "name": "pohw-governance",
          "repository": "P2poolBTC",
          "kind": "file",
          "pathHint": "target/release/pohw-governance",
          "platform": "builder-platform",
          "architecture": "builder-platform",
          "deterministic": true,
          "expectedCid": null,
          "expectedSha256": null,
          "expectedSize": null
        },
        {
          "name": "p2pool-node",
          "repository": "P2poolBTC",
          "kind": "file",
          "pathHint": "target/release/p2pool-node",
          "platform": "builder-platform",
          "architecture": "builder-platform",
          "deterministic": true,
          "expectedCid": null,
          "expectedSha256": null,
          "expectedSize": null
        },
        {
          "name": "idena-lite-indexer",
          "repository": "P2poolBTC",
          "kind": "file",
          "pathHint": "target/release/idena-lite-indexer",
          "platform": "builder-platform",
          "architecture": "builder-platform",
          "deterministic": true,
          "expectedCid": null,
          "expectedSha256": null,
          "expectedSize": null
        },
        {
          "name": "pohw-run-mining-adapter.sh",
          "repository": "P2poolBTC",
          "kind": "file",
          "pathHint": "scripts/pohw-run-mining-adapter.sh",
          "platform": "linux",
          "architecture": "any",
          "deterministic": true,
          "expectedCid": "bafkreia4pazulakvfig4ombnmslop3tqnfvldrj5rwautf2kjze3s3acde",
          "expectedSha256": "1c78334581552a0dc7302d6496e7ee70696ab1c53d8d8149974a4e49b96c0219",
          "expectedSize": 16185
        },
        {
          "name": "pohw-run-gossip-mesh.sh",
          "repository": "P2poolBTC",
          "kind": "file",
          "pathHint": "scripts/pohw-run-gossip-mesh.sh",
          "platform": "linux",
          "architecture": "any",
          "deterministic": true,
          "expectedCid": "bafkreihfjsd3qgvi2fjavzsq34r3ef42tw7v44yoi63sut4hxtsigd2eqi",
          "expectedSha256": "e54c87b81aa8d1520ae650df23b2179a9dbf5e730e47b72a4f87bce4830f4482",
          "expectedSize": 5523
        },
        {
          "name": "pohw-health-status.py",
          "repository": "P2poolBTC",
          "kind": "file",
          "pathHint": "scripts/pohw-health-status.py",
          "platform": "linux",
          "architecture": "any",
          "deterministic": true,
          "expectedCid": "bafkreibj4ufdmou2ondvypimul6mwfsbol2tzkhb5ralyci5y2wmuvlvtm",
          "expectedSha256": "29e50a363a9a73475c3d0ca2fccb164172f53ca8e1ec40bc091dc6acca55759b",
          "expectedSize": 29259
        },
        {
          "name": "pohw-experiment-1-launch-policy.py",
          "repository": "P2poolBTC",
          "kind": "file",
          "pathHint": "scripts/pohw-experiment-1-launch-policy.py",
          "platform": "linux",
          "architecture": "any",
          "deterministic": true,
          "expectedCid": "bafkreibwyy6b4syccndi7bo6cc7l7usqb5zx73k7j3wfm6ydohdf5ox2va",
          "expectedSha256": "36c63c1e4b0213468f85de10bebfd2500f737fed5f4eec567b0371c65ebafaa8",
          "expectedSize": 51740
        },
        {
          "name": "experiment-1-full-consensus.json",
          "repository": "P2poolBTC",
          "kind": "file",
          "pathHint": "compatibility/experiment-1-full-consensus.json",
          "platform": "all",
          "architecture": "any",
          "deterministic": true,
          "expectedCid": "bafkreiga72h3cgkugn75oapefxr5jikp2rkeliysj6dtnvfudmrmvkpqae",
          "expectedSha256": "c0fe8fb11954337fd701e42de3d4a14fd45445a3124f8736d4b41b22caa9f001",
          "expectedSize": 6461
        },
        {
          "name": "experiment-1-launch-policy.json",
          "repository": "P2poolBTC",
          "kind": "file",
          "pathHint": "compatibility/experiment-1-launch-policy.json",
          "platform": "all",
          "architecture": "any",
          "deterministic": true,
          "expectedCid": "bafkreih2dzcfsje5ik5r7nwaoeonhn4hxijobbsgu6ll5hvyze5myww5zi",
          "expectedSha256": "fa1e4459249d42bb1fb6c0711cd3b787ba12e08646a796be9eb8c93acc5addca",
          "expectedSize": 3961
        },
        {
          "name": "experiment-1-miner-registry-candidate.json",
          "repository": "P2poolBTC",
          "kind": "file",
          "pathHint": "compatibility/experiment-1-miner-registry-candidate.json",
          "platform": "all",
          "architecture": "any",
          "deterministic": true,
          "expectedCid": "bafkreidrlke7t5x7wmxkkzfqsnwrijezf6ymmtvpelbiuv4veou37n56vq",
          "expectedSha256": "715a89f9f6ffb32ea564b0936d1424992fb0c64eaf22c28a579523a9bfb7beac",
          "expectedSize": 2902
        },
        {
          "name": "bitcoind-pohw-experiment-1.service",
          "repository": "P2poolBTC",
          "kind": "file",
          "pathHint": "deploy/systemd/bitcoind-pohw-experiment-1.service",
          "platform": "linux",
          "architecture": "any",
          "deterministic": true,
          "expectedCid": "bafkreibvaxdefuih4cv4snnjtcnbdkytwzfounjqqe347ld6ahdize4gsy",
          "expectedSha256": "3505c642d107e0abc935a9989a11ab13b64aea35308137cfac7e01c68c938696",
          "expectedSize": 2398
        },
        {
          "name": "pohw-mining-adapter.service",
          "repository": "P2poolBTC",
          "kind": "file",
          "pathHint": "deploy/systemd/pohw-mining-adapter.service",
          "platform": "linux",
          "architecture": "any",
          "deterministic": true,
          "expectedCid": "bafkreidgpmextoxgvcuk3r65egvqegyvgzh44ypoj5egrali2z4g44qc7q",
          "expectedSha256": "667b0979bae6a8a8adc7dd21ab021b15364fce61ee4f48688168d6786e7202fc",
          "expectedSize": 1261
        },
        {
          "name": "pohw-gossip-mesh.service",
          "repository": "P2poolBTC",
          "kind": "file",
          "pathHint": "deploy/systemd/pohw-gossip-mesh.service",
          "platform": "linux",
          "architecture": "any",
          "deterministic": true,
          "expectedCid": "bafkreidwf2nbj5gfhoeupgfen6u4buk4pp4x54jmeoucfcqy2o62htyfoa",
          "expectedSha256": "762e9a14f4c53b894798a46fa9c0d15c7bf97ef12c23a8228a18d3bda3cf0570",
          "expectedSize": 1016
        },
        {
          "name": "pohw-mining-adapter-server.conf",
          "repository": "P2poolBTC",
          "kind": "file",
          "pathHint": "deploy/systemd/pohw-mining-adapter-server.conf",
          "platform": "linux",
          "architecture": "any",
          "deterministic": true,
          "expectedCid": "bafkreig4wnlikixtla3fapnlv43luenwsfnvt6cm36qfw7y2f5hye3jnvi",
          "expectedSha256": "dcb3568522f35836503dabaf36ba11b6915b59f84cdfa05b7f1a2f4f826d2daa",
          "expectedSize": 521
        },
        {
          "name": "pohw-gossip-mesh-server.conf",
          "repository": "P2poolBTC",
          "kind": "file",
          "pathHint": "deploy/systemd/pohw-gossip-mesh-server.conf",
          "platform": "linux",
          "architecture": "any",
          "deterministic": true,
          "expectedCid": "bafkreihkusklvpgkasejwhynunc2cguncxa7pisqd547ru6xwm5ym5kady",
          "expectedSha256": "eaa494babcca04889b1f0da345a11a8d15c1f7a2501f79f8d3d7b33b8675401e",
          "expectedSize": 482
        },
        {
          "name": "pohw-mining-experiment-1.conf",
          "repository": "P2poolBTC",
          "kind": "file",
          "pathHint": "deploy/systemd/pohw-mining-experiment-1.conf",
          "platform": "linux",
          "architecture": "any",
          "deterministic": true,
          "expectedCid": "bafkreiddccq3byj6jyuzsojctyjhpa6jsuskyn4hdqp4mdhsfozmaud6dy",
          "expectedSha256": "6310a1b0e13e4e299939229e127783c99524ac37871c1fc60cf22bb2c0507e1e",
          "expectedSize": 1003
        },
        {
          "name": "pohw-gossip-experiment-1.conf",
          "repository": "P2poolBTC",
          "kind": "file",
          "pathHint": "deploy/systemd/pohw-gossip-experiment-1.conf",
          "platform": "linux",
          "architecture": "any",
          "deterministic": true,
          "expectedCid": "bafkreiddccq3byj6jyuzsojctyjhpa6jsuskyn4hdqp4mdhsfozmaud6dy",
          "expectedSha256": "6310a1b0e13e4e299939229e127783c99524ac37871c1fc60cf22bb2c0507e1e",
          "expectedSize": 1003
        }
      ],
      "reproducibility": "deterministic-core",
      "limitations": [
        "Native linker and operating-system inputs must match before binary digests are compared across builders."
      ]
    },
    {
      "id": "governance-contract",
      "sourceRepositories": [
        "P2poolBTC",
        "idena-go",
        "idena-wasm-binding",
        "idena-wasm",
        "wasmer",
        "idena-sdk-js-lite"
      ],